{
  "contentVersion": 1,
  "schemaVersion": 1,
  "modes": [
    {
      "id": "arithmetic",
      "title": "Arithmetic",
      "description": "Master the four fundamental operations: addition, subtraction, multiplication, and division.",
      "order": 1,
      "stageIds": ["arithmetic-addition-01", "arithmetic-multiplication-02"]
    },
    {
      "id": "pre-algebra",
      "title": "Pre-Algebra",
      "description": "Build the bridge between arithmetic and algebra by working with variables and simple equations.",
      "order": 2,
      "stageIds": ["pre-algebra-variables-01", "pre-algebra-one-step-02"]
    },
    {
      "id": "algebra",
      "title": "Algebra",
      "description": "Explore linear equations, graphing, and the relationships between variables.",
      "order": 3,
      "stageIds": ["algebra-linear-01", "algebra-graphing-02"]
    },
    {
      "id": "linear-algebra",
      "title": "Linear Algebra",
      "description": "Work with vectors, matrices, and the foundations of multi-dimensional mathematics.",
      "order": 4,
      "stageIds": ["linear-algebra-vectors-01", "linear-algebra-matrices-02"]
    }
  ],
  "stages": [
    {
      "id": "arithmetic-addition-01",
      "modeId": "arithmetic",
      "title": "Addition & Subtraction Basics",
      "description": "Start with single-digit sums, build up to two-digit addition, and tackle subtraction with borrowing.",
      "order": 1,
      "prerequisiteStageIds": [],
      "passingStarThreshold": 6,
      "levels": [
        {
          "id": "arithmetic-addition-01-lv1",
          "stageId": "arithmetic-addition-01",
          "order": 1,
          "title": "Single-Digit Addition",
          "introduction": {
            "body": "Addition means combining two numbers to find their total. For example, when you add 3 and 4 you get 7.",
            "examplePrompt": "What is 3 + 4?",
            "exampleSolution": "3 + 4 = 7. Count 3 objects, then count 4 more — you have 7 in total."
          },
          "hintAllowance": 3,
          "questionCount": 10,
          "timeLimit": null,
          "generatorConfig": {
            "questionTypes": ["multiple-choice", "numeric-input"],
            "operands": { "min": 1, "max": 9 },
            "allowNegatives": false,
            "allowFractions": false,
            "allowDecimals": false,
            "variableCount": null,
            "difficultyRange": [1, 3]
          },
          "starThresholds": { "oneStar": 50, "twoStar": 70, "threeStar": 90 }
        },
        {
          "id": "arithmetic-addition-01-lv2",
          "stageId": "arithmetic-addition-01",
          "order": 2,
          "title": "Two-Digit Addition",
          "introduction": {
            "body": "Now we add two-digit numbers. Remember to line up the ones and tens columns when carrying.",
            "examplePrompt": "What is 23 + 48?",
            "exampleSolution": "3 + 8 = 11, write 1 carry 1. 2 + 4 + 1 = 7. Answer: 71."
          },
          "hintAllowance": 3,
          "questionCount": 10,
          "timeLimit": null,
          "generatorConfig": {
            "questionTypes": ["numeric-input", "fill-in-the-blank"],
            "operands": { "min": 10, "max": 99 },
            "allowNegatives": false,
            "allowFractions": false,
            "allowDecimals": false,
            "variableCount": null,
            "difficultyRange": [3, 6]
          },
          "starThresholds": { "oneStar": 50, "twoStar": 70, "threeStar": 90 }
        },
        {
          "id": "arithmetic-addition-01-lv3",
          "stageId": "arithmetic-addition-01",
          "order": 3,
          "title": "Subtraction with Borrowing",
          "introduction": {
            "body": "When the top digit is smaller than the bottom digit, borrow 10 from the column to the left.",
            "examplePrompt": "What is 52 - 37?",
            "exampleSolution": "Borrow 10: 12 - 7 = 5. 4 - 3 = 1. Answer: 15."
          },
          "hintAllowance": 3,
          "questionCount": 10,
          "timeLimit": 120,
          "generatorConfig": {
            "questionTypes": ["numeric-input", "fill-in-the-blank"],
            "operands": { "min": 10, "max": 99 },
            "allowNegatives": false,
            "allowFractions": false,
            "allowDecimals": false,
            "variableCount": null,
            "difficultyRange": [5, 8]
          },
          "starThresholds": { "oneStar": 50, "twoStar": 70, "threeStar": 90 }
        }
      ],
      "challengeLevel": {
        "id": "arithmetic-addition-01-challenge",
        "stageId": "arithmetic-addition-01",
        "title": "Addition & Subtraction Challenge",
        "questionCount": 15,
        "timeLimit": null,
        "passingAccuracy": 0.7,
        "retryAllowed": true,
        "generatorConfigs": [
          {
            "questionTypes": ["multiple-choice", "numeric-input"],
            "operands": { "min": 1, "max": 99 },
            "allowNegatives": false,
            "allowFractions": false,
            "allowDecimals": false,
            "variableCount": null,
            "difficultyRange": [1, 6]
          },
          {
            "questionTypes": ["fill-in-the-blank"],
            "operands": { "min": 10, "max": 99 },
            "allowNegatives": false,
            "allowFractions": false,
            "allowDecimals": false,
            "variableCount": null,
            "difficultyRange": [3, 8]
          }
        ],
        "difficultyWeights": { "easy": 0.2, "medium": 0.3, "hard": 0.5 }
      }
    },
    {
      "id": "arithmetic-multiplication-02",
      "modeId": "arithmetic",
      "title": "Multiplication & Division Basics",
      "description": "Learn your times tables and discover how division is the inverse of multiplication.",
      "order": 2,
      "prerequisiteStageIds": ["arithmetic-addition-01"],
      "passingStarThreshold": 6,
      "levels": [
        {
          "id": "arithmetic-multiplication-02-lv1",
          "stageId": "arithmetic-multiplication-02",
          "order": 1,
          "title": "Times Tables 1–5",
          "introduction": {
            "body": "Multiplication is repeated addition. 3 × 4 means adding 3 four times: 3 + 3 + 3 + 3 = 12.",
            "examplePrompt": "What is 3 × 4?",
            "exampleSolution": "3 × 4 = 12. Think of it as 3 added 4 times: 3 + 3 + 3 + 3 = 12."
          },
          "hintAllowance": 3,
          "questionCount": 10,
          "timeLimit": null,
          "generatorConfig": {
            "questionTypes": ["multiple-choice", "tile-selection"],
            "operands": { "min": 1, "max": 5 },
            "allowNegatives": false,
            "allowFractions": false,
            "allowDecimals": false,
            "variableCount": null,
            "difficultyRange": [1, 3]
          },
          "starThresholds": { "oneStar": 50, "twoStar": 70, "threeStar": 90 }
        },
        {
          "id": "arithmetic-multiplication-02-lv2",
          "stageId": "arithmetic-multiplication-02",
          "order": 2,
          "title": "Times Tables 6–10",
          "introduction": {
            "body": "Extend your multiplication knowledge to the larger times tables. Patterns and tricks can help you remember them.",
            "examplePrompt": "What is 7 × 8?",
            "exampleSolution": "7 × 8 = 56. A memory trick: 5, 6, 7, 8 — 56 = 7 × 8."
          },
          "hintAllowance": 3,
          "questionCount": 10,
          "timeLimit": null,
          "generatorConfig": {
            "questionTypes": ["multiple-choice", "numeric-input"],
            "operands": { "min": 6, "max": 10 },
            "allowNegatives": false,
            "allowFractions": false,
            "allowDecimals": false,
            "variableCount": null,
            "difficultyRange": [3, 6]
          },
          "starThresholds": { "oneStar": 50, "twoStar": 70, "threeStar": 90 }
        },
        {
          "id": "arithmetic-multiplication-02-lv3",
          "stageId": "arithmetic-multiplication-02",
          "order": 3,
          "title": "Division as Inverse Multiplication",
          "introduction": {
            "body": "Division is the opposite of multiplication. If 3 × 4 = 12, then 12 ÷ 4 = 3.",
            "examplePrompt": "What is 24 ÷ 6?",
            "exampleSolution": "Ask: what number times 6 equals 24? Answer: 4. So 24 ÷ 6 = 4."
          },
          "hintAllowance": 3,
          "questionCount": 10,
          "timeLimit": 120,
          "generatorConfig": {
            "questionTypes": ["numeric-input", "fill-in-the-blank"],
            "operands": { "min": 1, "max": 10 },
            "allowNegatives": false,
            "allowFractions": false,
            "allowDecimals": false,
            "variableCount": null,
            "difficultyRange": [5, 8]
          },
          "starThresholds": { "oneStar": 50, "twoStar": 70, "threeStar": 90 }
        }
      ],
      "challengeLevel": {
        "id": "arithmetic-multiplication-02-challenge",
        "stageId": "arithmetic-multiplication-02",
        "title": "Multiplication & Division Challenge",
        "questionCount": 15,
        "timeLimit": null,
        "passingAccuracy": 0.7,
        "retryAllowed": true,
        "generatorConfigs": [
          {
            "questionTypes": ["multiple-choice", "tile-selection"],
            "operands": { "min": 1, "max": 10 },
            "allowNegatives": false,
            "allowFractions": false,
            "allowDecimals": false,
            "variableCount": null,
            "difficultyRange": [1, 4]
          },
          {
            "questionTypes": ["numeric-input", "fill-in-the-blank"],
            "operands": { "min": 1, "max": 10 },
            "allowNegatives": false,
            "allowFractions": false,
            "allowDecimals": false,
            "variableCount": null,
            "difficultyRange": [3, 8]
          }
        ],
        "difficultyWeights": { "easy": 0.2, "medium": 0.3, "hard": 0.5 }